{
  "$schema": "http://json-schema.org/draft-07/schema#",
  "$id": "https://kerfors.github.io/soa2usdm/schemas/soa-table-corrections.json",
  "title": "SoA Table Corrections Schema",
  "description": "Human corrections to a raw soa-table-extraction. The raw extraction is immutable; corrections here are applied to produce the verified extraction that feeds resolution. Each correction is source-linked and self-describing, so the corrections corpus doubles as a provenance record and a feedback dataset for extraction-prompt refinement.",
  "type": "object",
  "required": ["schema_name", "schema_version", "target_extraction", "corrections"],
  "additionalProperties": false,
  "properties": {
    "schema_name": {
      "const": "soa-table-corrections",
      "description": "Schema identifier."
    },
    "schema_version": {
      "enum": ["1.0", "1.1"],
      "description": "Schema version. 1.1 adds ops 'add_item' and 'remove_item' with 'field' and 'value'; files stamped 1.0 remain valid."
    },
    "target_extraction": {
      "type": "string",
      "description": "Filename of the raw extraction JSON this sidecar corrects."
    },
    "corrections": {
      "type": "array",
      "items": {
        "type": "object",
        "required": ["id", "target", "op", "reason", "by", "at"],
        "additionalProperties": false,
        "properties": {
          "id": {
            "type": "string",
            "description": "Correction identifier, unique within this file (e.g. 'corr-001')."
          },
          "target": {
            "type": "string",
            "enum": ["schedule_properties", "schedule_grid", "activities", "activity_schedule", "annotations", "review_items", "table_metadata"],
            "description": "Which extraction array this correction acts on. 'table_metadata' is the one object, not an array: it takes op 'set' without 'match', and 'table_number' cannot be set."
          },
          "op": {
            "type": "string",
            "enum": ["add", "set", "remove", "confirm", "add_item", "remove_item"],
            "description": "add=append 'set' as a new entry; set=update the single entry matching 'match'; remove=drop entries matching 'match'; confirm=change nothing - records that the reviewer examined the review item named in 'review_item' and kept the call (requires 'review_item'; no 'match' or 'set'); add_item=append 'value' to the array-valued field named in 'field' of the single entry matching 'match'; remove_item=drop from that array the one element equal to 'value' (an error if it is not there exactly once). Both require 'field' and 'value' and take no 'set'."
          },
          "match": {
            "type": "object",
            "description": "Key fields locating the target entry (e.g. table_number/row_position/column_position). Required for 'set', 'remove', 'add_item' and 'remove_item'; omit for 'add'."
          },
          "set": {
            "type": "object",
            "description": "Field values to write. For 'add', the full new entry; for 'set', the fields to update. Omit for 'remove'."
          },
          "field": {
            "type": "string",
            "description": "For 'add_item' and 'remove_item': name of the array-valued field of the matched entry (e.g. 'marker_locations')."
          },
          "value": {
            "description": "For 'add_item' and 'remove_item': the one array element to append or to drop, written in full (compared as a whole, not field by field)."
          },
          "reason": {
            "type": "string",
            "description": "Human explanation of why this correction was made."
          },
          "source_ref": {
            "type": "object",
            "description": "Where in the source document this correction is grounded, for audit back to source.",
            "properties": {
              "page": {"type": "integer"},
              "row_position": {"type": "integer"},
              "column_position": {"type": "integer"},
              "cell_value": {"type": "string"}
            }
          },
          "by": {
            "type": "string",
            "description": "Who made the correction."
          },
          "at": {
            "type": "string",
            "format": "date-time",
            "description": "When the correction was made (ISO 8601)."
          },
          "review_item": {
            "type": "string",
            "pattern": "^D[0-9]+$",
            "description": "Id of the extraction's review_items entry this correction answers. An item is decided exactly when some correction in this file names it: with op 'confirm' the call stands, with any other op this correction is the alternative taken. Absent on corrections that are not answers to a review item."
          }
        }
      }
    }
  }
}
