{
 "schema_name": "soa-table-corrections",
 "schema_version": "1.0",
 "target_extraction": "NCT03637764_Table_01_extraction.json",
 "corrections": [
  {
   "id": "corr-001",
   "target": "activity_schedule",
   "op": "remove",
   "review_item": "D2",
   "match": {
    "row_position": 28
   },
   "reason": "Alternative taken for D2: the cell spanning every data column and the Notes column is a cross-reference with no timing; recorded as a source_note on the activity and the grid cells left empty. Same treatment as NCT02291289 'See Appendix 19' and NCT04184622 D7. The flow charts themselves are review item D1. (Kerstin, 2026-09-27 review session, group K.)",
   "source_ref": {
    "page": 21,
    "row_position": 28
   },
   "by": "Kerstin Forsberg",
   "at": "2026-09-27T19:45:00+02:00"
  },
  {
   "id": "corr-002",
   "target": "activity_schedule",
   "op": "remove",
   "match": {
    "row_position": 29
   },
   "reason": "Alternative taken for D2: the cell spanning every data column and the Notes column is a cross-reference with no timing; recorded as a source_note on the activity and the grid cells left empty. Same treatment as NCT02291289 'See Appendix 19' and NCT04184622 D7. The flow charts themselves are review item D1. (Kerstin, 2026-09-27 review session, group K.)",
   "source_ref": {
    "page": 21,
    "row_position": 29
   },
   "by": "Kerstin Forsberg",
   "at": "2026-09-27T19:45:00+02:00"
  },
  {
   "id": "corr-003",
   "target": "activity_schedule",
   "op": "remove",
   "match": {
    "row_position": 30
   },
   "reason": "Alternative taken for D2: the cell spanning every data column and the Notes column is a cross-reference with no timing; recorded as a source_note on the activity and the grid cells left empty. Same treatment as NCT02291289 'See Appendix 19' and NCT04184622 D7. The flow charts themselves are review item D1. (Kerstin, 2026-09-27 review session, group K.)",
   "source_ref": {
    "page": 21,
    "row_position": 30
   },
   "by": "Kerstin Forsberg",
   "at": "2026-09-27T19:45:00+02:00"
  },
  {
   "id": "corr-004",
   "target": "annotations",
   "op": "add",
   "set": {
    "annotation_marker": "pr7",
    "annotation_type": "source_note",
    "annotation_text": "See Pharmacokinetics and immunogenicity Flow Chart",
    "marker_locations": [
     {
      "table_number": 1,
      "location_type": "activity_name",
      "row_position": 28,
      "method": "synthesized"
     },
     {
      "table_number": 1,
      "location_type": "activity_name",
      "row_position": 29,
      "method": "synthesized"
     }
    ]
   },
   "reason": "Alternative taken for D2: the cell spanning every data column and the Notes column is a cross-reference with no timing; recorded as a source_note on the activity and the grid cells left empty. Same treatment as NCT02291289 'See Appendix 19' and NCT04184622 D7. The flow charts themselves are review item D1. (Kerstin, 2026-09-27 review session, group K.)",
   "source_ref": {
    "page": 21
   },
   "by": "Kerstin Forsberg",
   "at": "2026-09-27T19:45:00+02:00"
  },
  {
   "id": "corr-005",
   "target": "annotations",
   "op": "add",
   "set": {
    "annotation_marker": "pr8",
    "annotation_type": "source_note",
    "annotation_text": "See Biomarker Flow Chart",
    "marker_locations": [
     {
      "table_number": 1,
      "location_type": "activity_name",
      "row_position": 30,
      "method": "synthesized"
     }
    ]
   },
   "reason": "Alternative taken for D2: the cell spanning every data column and the Notes column is a cross-reference with no timing; recorded as a source_note on the activity and the grid cells left empty. Same treatment as NCT02291289 'See Appendix 19' and NCT04184622 D7. The flow charts themselves are review item D1. (Kerstin, 2026-09-27 review session, group K.)",
   "source_ref": {
    "page": 21
   },
   "by": "Kerstin Forsberg",
   "at": "2026-09-27T19:45:00+02:00"
  },
  {
   "id": "corr-006",
   "target": "activities",
   "op": "set",
   "match": {
    "row_position": 28
   },
   "set": {
    "annotation_markers": "pr7"
   },
   "reason": "Binds source_note pr7 to the row (D2 alternative). (Kerstin, 2026-09-27 review session, group K.)",
   "source_ref": {
    "page": 21,
    "row_position": 28
   },
   "by": "Kerstin Forsberg",
   "at": "2026-09-27T19:45:00+02:00"
  },
  {
   "id": "corr-007",
   "target": "activities",
   "op": "set",
   "match": {
    "row_position": 29
   },
   "set": {
    "annotation_markers": "pr7"
   },
   "reason": "Binds source_note pr7 to the row (D2 alternative). (Kerstin, 2026-09-27 review session, group K.)",
   "source_ref": {
    "page": 21,
    "row_position": 29
   },
   "by": "Kerstin Forsberg",
   "at": "2026-09-27T19:45:00+02:00"
  },
  {
   "id": "corr-008",
   "target": "activities",
   "op": "set",
   "match": {
    "row_position": 30
   },
   "set": {
    "annotation_markers": "pr8"
   },
   "reason": "Binds source_note pr8 to the row (D2 alternative). (Kerstin, 2026-09-27 review session, group K.)",
   "source_ref": {
    "page": 21,
    "row_position": 30
   },
   "by": "Kerstin Forsberg",
   "at": "2026-09-27T19:45:00+02:00"
  },
  {
   "id": "corr-009",
   "target": "annotations",
   "op": "confirm",
   "review_item": "D5",
   "reason": "Kept as extracted: footnote c is bound to the 16 cells printed with superscript c; its text sits in the Notes column of the Isatuximab row as a legend, like footnote a in the header Notes cell. (Kerstin, 2026-09-27 review session, group M4.)",
   "source_ref": {
    "page": 20
   },
   "by": "Kerstin Forsberg",
   "at": "2026-09-27T19:58:00+02:00"
  },
  {
   "id": "corr-010",
   "target": "schedule_properties",
   "op": "confirm",
   "review_item": "D3",
   "reason": "Kept as extracted: row 2 (Cycle 1, Cycle 2 and Beyond, Safety follow-up, Survival follow-up) typed period: sub-phases of Treatment and Post-Treatment. Rule (group D-a): a header band is typed by its dominant content; a printed row label wins; single-column visit labels inside an epoch/period band stay values of that band. (Kerstin, 2026-09-27 review session, group D-a.)",
   "source_ref": {
    "page": 18
   },
   "by": "Kerstin Forsberg",
   "at": "2026-09-27T20:09:00+02:00"
  },
  {
   "id": "corr-011",
   "target": "activities",
   "op": "confirm",
   "review_item": "D4",
   "reason": "Kept as extracted: the top-of-page lab rows stay under Laboratory Assessments; the bold administration rows carry marks and are activities, so the rows after the Disease Assessment block are level 0. Rule (group H): hierarchy follows printed signals (indent, bold, shading, full-width section bands); a group stays open across a page break until the next header; no implicit group is invented; a label cell spanning sub-rows is a parent with children. (Kerstin, 2026-09-27 review session, group H.)",
   "source_ref": {
    "page": 20
   },
   "by": "Kerstin Forsberg",
   "at": "2026-09-27T20:15:00+02:00"
  },
  {
   "id": "corr-012",
   "target": "activity_schedule",
   "op": "confirm",
   "review_item": "D6",
   "reason": "Kept as extracted: qualified entries such as 'X (Weeks 9, 18, 27, and then every 12 weeks)' stay literally in their one ruled cell (group K rule). (Kerstin, 2026-09-27 review session, group L.)",
   "source_ref": {
    "page": 20
   },
   "by": "Kerstin Forsberg",
   "at": "2026-09-27T20:21:00+02:00"
  },
  {
   "id": "corr-013",
   "target": "table_metadata",
   "op": "set",
   "review_item": "D1",
   "set": {
    "notes": "Primary anchor grid; one printed table running over four pages under a reprinted header (not continuations). Cross-references PK/ADA and biomarker flow charts on pages 22-24 which are outside the declared SoA range; they are extracted as subsidiary Tables 02 ('Pharmacokinetics and Immunogenicity Flow Chart', pp.22-23) and 03 ('Exploratory Biomarker Flow Chart', p.24)."
   },
   "reason": "Alternative taken for D1: the two flow charts were extracted as subsidiary Tables 02 and 03 in a targeted blind session (inventory item 19); their decisions D7-D13 are in their own sidecars. The PK, ADA and biomarker rows of this table keep only source notes pr7/pr8 (group K) and point to those tables. (Kerstin, 2026-09-27, item-19 session.)",
   "source_ref": {
    "page": 22
   },
   "by": "Kerstin Forsberg",
   "at": "2026-09-27T21:00:00+02:00"
  }
 ]
}
